{
  "$schema": "../../../schemas/work-item.schema.json",
  "id": "002",
  "title": "Provisional work",
  "status": "active",
  "owner_scope": "governance",
  "affected_scopes": [],
  "depends_on": [],
  "provenance": "provisional",
  "preflight": {
    "created_before_work_started": true,
    "created_at": "2026-01-02T00:00:00Z",
    "note": "The provisional item was recorded before work began."
  },
  "acceptance_criteria": [
    {"id": "AC-1", "text": "Evidence is ratcheted", "state": "pending", "evidence": []}
  ],
  "created": "2026-01-02",
  "updated": "2026-01-02"
}
